{
  "$schema": "./content.schema.json",
  "name": "你的名字",
  "role": "计算机专业学生",
  "location": "城市",
  "tagline": "喜欢把想法做成能打开的东西。",
  "about": [
    "正在读计算机，平时写页面、脚本，也会把课上的东西做成一个能演示的小项目。",
    "希望做出清楚、好用、看起来也舒服的东西。"
  ],
  "email": "hello@example.com",
  "links": [
    {
      "label": "GitHub",
      "url": "https://github.com/songlingfengxhxuenai"
    },
    {
      "label": "邮箱",
      "url": "mailto:hello@example.com"
    }
  ],
  "education": [
    {
      "school": "某某大学",
      "program": "计算机科学与技术 · 本科",
      "period": "2023 — 2027",
      "detail": "课程之外会自己做小项目，把课堂里的想法做成能打开的页面。"
    },
    {
      "school": "某某中学",
      "program": "高中",
      "period": "2020 — 2023",
      "detail": "在这里补一句你当时在做的事。不需要就删掉整条。"
    }
  ],
  "experience": [
    {
      "org": "学生工作室",
      "role": "成员",
      "period": "2025 — 现在",
      "detail": "负责页面和小组里的日常协作，把一个想法从草稿做成可以给别人看的版本。"
    },
    {
      "org": "课程项目组",
      "role": "负责人",
      "period": "2024 秋",
      "detail": "带小组把课程作业做成可演示的结果，并写清楚每个人做了什么。"
    }
  ],
  "projects": [
    {
      "name": "课程小站",
      "summary": "把课程内容收成一个可以浏览的小站，负责页面结构和样式。",
      "url": "https://github.com/songlingfengxhxuenai",
      "tags": ["HTML", "CSS"]
    },
    {
      "name": "实验笔记",
      "summary": "把一次实验的问题、做法和结果整理成能回头翻的笔记。",
      "url": "https://github.com/songlingfengxhxuenai",
      "tags": ["Python"]
    },
    {
      "name": "还没命名的工具",
      "summary": "一个还在做的小工具。暂时没有链接，所以这张卡片不能点开。",
      "tags": ["JavaScript"]
    }
  ],
  "skills": [
    {
      "group": "语言",
      "items": ["Python", "JavaScript", "C"]
    },
    {
      "group": "工具",
      "items": ["Git", "VS Code", "Linux"]
    }
  ]
}
